{"assertedInventoryDigest":"sha256:0cdae349b63b48ecb5e2021333a11cb3a27d855d76eed8606ea3a4c97d764d68","binding":{"acceptanceSchemaDigest":"sha256:1057490a6bf3422bc8477ad215715ff63d92a407ffa47526c48cd942efab7617","bindingBundleDigest":"sha256:9806f468e8dd9154babf7576324c865178a8dc5079e67eee93215b45c09094d6","manifestSchemaDigest":"sha256:52a35047dbcacb24ecd0bbfd1be9a4f6fba2089fad9d4a16afee8d25590aa155","ontologyDigest":"sha256:d000375a0b98180a0319b31a91cdbb1c1b4d8166559a1e0ca0c95ea2d4c1c6cf","shapesDigest":"sha256:c0cd6bdf7a3f6962e958779199a973400d3c4811e866f73e3110282c7eb209cb","sourceAccountingSchemaDigest":"sha256:0ffc9189fb0e2727be0f047e61a71c5afe3de0f0658d4d97515ceefa5778d7eb","validatorVersion":"3.0","version":"3.0"},"checks":["deterministic authenticated fixture construction"],"constructionSummary":{"compactPackCount":46,"compactPackInventoryDigest":"sha256:1256c98bc226442540a7a4db4c21e3c7df2ab3038a436d5017710f837164e8c1","digest":"sha256:2ac4b47f6d598ff08066b7fa5a6f658c9b54c1802cd51f99940cd05950ba0096","path":"atlas-construction-summary.json","profile":"atlas-3-authenticated-construction-summary-v1","releaseCount":8,"releaseInventoryDigest":"sha256:2874cfc16074cbd380645b2581cd4ad8a74ec7e04bec790df91f8d87ed221bcc"},"constructorProfile":"atlas-3-source-and-evidence-backed-mapping-compiled-shacl-v1","counts":{"crossRingRelationAssertions":3,"derivedRelations":1,"identifiers":1,"labels":10,"mappingAssertions":2,"nativeRelationAssertions":2,"projectedRelations":10,"relationAssertions":10,"releases":8,"resources":10,"sourceAssignments":3,"sourceRecords":10},"implementationDigest":"sha256:8c9a8e6a32f82474d5ba328d8e17357c9cce1b3e57daaba35768f14a68ed0689","mode":"compiledSourceAndEvidenceBackedMappingProducerValidation","shaclDataProof":"compiledAgainstPinnedOntologyAndShapes","shaclMetaValidation":"pySHACL","sourceAccountingDigest":"sha256:50181551e26b5bdafdb035e6758744cb01bf7e8bdfee00e93c586b81b0676191","sourceReleaseCount":8,"status":"passed","type":"AtlasProducerValidation","version":"3.0"}
