{"assertedInventoryDigest":"sha256:3c4e92700d4b0afbb843bd1ae1b9d96bfe325886f36591d5f8afd6a85cbda3a4","binding":{"acceptanceSchemaDigest":"sha256:1057490a6bf3422bc8477ad215715ff63d92a407ffa47526c48cd942efab7617","bindingBundleDigest":"sha256:06dc61914a1d8f9cee6c008b75177094d9877919a9c6e2575016c00d53431582","manifestSchemaDigest":"sha256:52a35047dbcacb24ecd0bbfd1be9a4f6fba2089fad9d4a16afee8d25590aa155","ontologyDigest":"sha256:f18b055e029cb0df70b9cb393b8de8ef48f8f37c7fd3ae8f07afd0ec633a55fa","shapesDigest":"sha256:f8a3c1ddf90ad05bdb782b878c6288cfaf0cc96a027c54c78a7a672e650fc3c6","sourceAccountingSchemaDigest":"sha256:0ffc9189fb0e2727be0f047e61a71c5afe3de0f0658d4d97515ceefa5778d7eb","validatorVersion":"3.0","version":"3.0"},"checks":["deterministic authenticated fixture construction"],"constructionSummary":{"compactPackCount":46,"compactPackInventoryDigest":"sha256:588c32ac820ed7590979c909ff793128fbae29efa3c3db71bfbd8fd414e34aad","digest":"sha256:75234161ad0a8975a8783286f6a29052ff2f2dfb6f62f0d7273787c6d5b1cd11","path":"atlas-construction-summary.json","profile":"atlas-3-authenticated-construction-summary-v1","releaseCount":8,"releaseInventoryDigest":"sha256:b82ada94e31beb02da406e7780ab76c06d3c19ad3315f1d0d20e9fbf3bab8899"},"constructorProfile":"atlas-3-source-and-evidence-backed-mapping-compiled-shacl-v1","counts":{"crossRingRelationAssertions":3,"derivedRelations":1,"identifiers":1,"labels":10,"mappingAssertions":2,"nativeRelationAssertions":2,"projectedRelations":10,"relationAssertions":10,"releases":8,"resources":10,"sourceAssignments":3,"sourceRecords":10},"implementationDigest":"sha256:ce1415faa696f38835c8e0f845e9d3e8ad7af31bf8ef143f9daf3a9929ff68ca","mode":"compiledSourceAndEvidenceBackedMappingProducerValidation","shaclDataProof":"compiledAgainstPinnedOntologyAndShapes","shaclMetaValidation":"pySHACL","sourceAccountingDigest":"sha256:89b07156cfc03d9035874141e41db015d016984bf4a1e1690796430c99129f99","sourceReleaseCount":8,"status":"passed","type":"AtlasProducerValidation","version":"3.0"}
