{"assertedInventoryDigest":"sha256:d094f38c941b26df5c96f88b88e38bbabae34ddd41eaa97e53de9dd84f423180","binding":{"acceptanceSchemaDigest":"sha256:1057490a6bf3422bc8477ad215715ff63d92a407ffa47526c48cd942efab7617","bindingBundleDigest":"sha256:12420b28953e8da96154d60325da9490be54012a7e62b03ddfd4f53fe6c6d85b","manifestSchemaDigest":"sha256:52a35047dbcacb24ecd0bbfd1be9a4f6fba2089fad9d4a16afee8d25590aa155","ontologyDigest":"sha256:ad183688e64bd4845f369968b21c948034c634b8fb4a98989369e48705a631b6","shapesDigest":"sha256:9366d4a502b6c83eb95984f1b1471d440a7272b4190c2f8c02888de8b6c2a7c2","sourceAccountingSchemaDigest":"sha256:0ffc9189fb0e2727be0f047e61a71c5afe3de0f0658d4d97515ceefa5778d7eb","validatorVersion":"3.0","version":"3.0"},"checks":["deterministic authenticated fixture construction"],"constructionSummary":{"compactPackCount":49,"compactPackInventoryDigest":"sha256:3095aaf5731814cdb5afc73f93f057f8cab76b479f5ddd985bfa49438c6e92b0","digest":"sha256:bf7d5846b7d70cf2967877a71fd849466cc0cd60c1a7f1583a7e725b3030330d","path":"atlas-construction-summary.json","profile":"atlas-3-authenticated-construction-summary-v1","releaseCount":9,"releaseInventoryDigest":"sha256:4d0a946e1fd0b6b3d9c3a793d0437dd20df13f9ce0582a18f17db49fbbd92ce8"},"constructorProfile":"atlas-3-source-and-evidence-backed-mapping-compiled-shacl-v1","counts":{"crossRingRelationAssertions":3,"derivedRelations":1,"identifiers":1,"labels":12,"mappingAssertions":4,"nativeRelationAssertions":2,"projectedRelations":12,"relationAssertions":12,"releases":9,"resources":11,"sourceAssignments":3,"sourceRecords":11},"implementationDigest":"sha256:25a996b6e6a33335977a0b29a2c07488d0ee43a92e4b3a502ce379fd56cbb5e3","mode":"compiledSourceAndEvidenceBackedMappingProducerValidation","shaclDataProof":"compiledAgainstPinnedOntologyAndShapes","shaclMetaValidation":"pySHACL","sourceAccountingDigest":"sha256:da1a2f9723c078ee0d8b429ff4541ff031b47d7ddae363451a2a78089298418d","sourceReleaseCount":9,"status":"passed","type":"AtlasProducerValidation","version":"3.0"}
